StockCode,Description,Return_Count,Total_Units_Returned
21621,VINTAGE UNION JACK BUNTING,4,28
22385,JUMBO BAG SPACEBOY DESIGN,4,118
23225,CHERUB HEART DECORATION SILVER ,4,84
22141,CHRISTMAS CRAFT TREE TOP ANGEL,4,16
22107,PIZZA PLATE IN BOX,4,21
22580,ADVENT CALENDAR GINGHAM SACK,4,61
22989,SET 2 PANTRY DESIGN TEA TOWELS,4,24
84029G,KNITTED UNION FLAG HOT WATER BOTTLE,4,14
22854,CREAM SWEETHEART EGG HOLDER,3,3
22383,LUNCH BAG SUKI  DESIGN ,3,4
22425,ENAMEL COLANDER CREAM,3,6
84766,SILVER ROCOCO CANDLE STICK,3,15
21108,FAIRY CAKE FLANNEL ASSORTED COLOUR,3,3150
21090,SET/6 COLLAGE PAPER PLATES,3,36
84692,BOX OF 24 COCKTAIL PARASOLS,3,31
21124,SET/10 BLUE POLKADOT PARTY CANDLES,3,49
21122,SET/10 PINK POLKADOT PARTY CANDLES,3,49
22374,AIRLINE BAG VINTAGE JET SET RED,3,4
22366,DOORMAT AIRMAIL ,3,27
47590A,BLUE HAPPY BIRTHDAY BUNTING,3,24
85174,S/4 CACTI CANDLES,3,3
20679,EDWARDIAN PARASOL RED,3,9
20676,RED RETROSPOT BOWL,3,22
90185C,BLACK DIAMANTE EXPANDABLE RING,3,16
22154,ANGEL DECORATION 3 BUTTONS ,3,7
22153,ANGEL DECORATION STARS ON DRESS,3,70
22571,ROCKING HORSE RED CHRISTMAS ,3,109
22570,FELTCRAFT CUSHION RABBIT,3,245
22569,FELTCRAFT CUSHION BUTTERFLY,3,194
22561,WOODEN SCHOOL COLOURING SET,3,276
22585,PACK OF 6 BIRDY GIFT TAGS,3,45
22578,WOODEN STAR CHRISTMAS SCANDINAVIAN,3,133
22983,CARD BILLBOARD FONT,3,181
21262,WHITE GOOSE FEATHER CHRISTMAS TREE ,3,5
22144,CHRISTMAS CRAFT LITTLE FRIENDS,3,44
22128,PARTY CONES CANDY ASSORTED,3,56
23230,WRAP ALPHABET DESIGN,3,75
23196,VINTAGE LEAF MAGNETIC NOTEPAD,3,13
23212,HEART WREATH DECORATION WITH BELL,3,60
82551,LAUNDRY 15C METAL SIGN,3,4
22970,LONDON BUS COFFEE MUG,3,16
22601,CHRISTMAS RETROSPOT ANGEL WOOD,3,4
22600,CHRISTMAS RETROSPOT STAR WOOD,3,28
22588,CARD HOLDER GINGHAM HEART,3,195
22079,RIBBON REEL HEARTS DESIGN ,3,30
22067,CHOC TRUFFLE GOLD TRINKET POT ,3,6
22103,MIRROR MOSAIC T-LIGHT HOLDER ROUND,3,482
22088,PAPER BUNTING COLOURED LACE,3,56
22187,GREEN CHRISTMAS TREE CARD HOLDER,3,4
20985,HEART CALCULATOR,3,16
20983,12 PENCILS TALL TUBE RED RETROSPOT,3,7
20982,12 PENCILS TALL TUBE SKULLS,3,4
20974,12 PENCILS SMALL TUBE SKULL,3,566
22995,TRAVEL CARD WALLET SUKI,3,49
21244,BLUE POLKADOT PLATE ,3,15
22959,WRAP CHRISTMAS VILLAGE,3,300
22956,36 FOIL HEART CAKE CASES,3,152
84987,SET OF 36 TEATIME PAPER DOILIES,3,15
20969,RED FLORAL FELTCRAFT SHOULDER BAG,3,289
23274,STAR T-LIGHT HOLDER WILLIE WINKIE,3,3
23255,CHILDRENS CUTLERY CIRCUS PARADE,3,9
23242,TREASURE TIN BUFFALO BILL ,3,27
23291,DOLLY GIRL CHILDRENS CUP,3,10
23286,BLUE VINTAGE SPOT BEAKER,3,49
22045,SPACEBOY GIFT WRAP,3,75
22027,TEA PARTY BIRTHDAY CARD,3,168
20931,BLUE POT PLANT CANDLE ,3,15
84968A,SET OF 16 VINTAGE ROSE CUTLERY,3,10
22618,COOKING SET RETROSPOT,3,20
84279B,CHERRY BLOSSOM DECORATIVE FLASK,3,7
84050,PINK HEART SHAPE EGG FRYING PAN,3,14
21930,JUMBO STORAGE BAG SKULLS,3,3
21980,PACK OF 12 RED RETROSPOT TISSUES ,3,132
21975,PACK OF 60 DINOSAUR CAKE CASES,3,71
85036C,ROSE 1 WICK MORRIS BOXED CANDLE,3,193
85035A,GARDENIA 3 WICK MORRIS BOXED CANDLE,3,6
85034A,3 GARDENIA MORRIS BOXED CANDLES,3,7
21932,SCANDINAVIAN PAISLEY PICNIC BAG,3,33
79163,BLACK CHAMPAGNE GLASS,3,10
79160,HEART SHAPE WIRELESS DOORBELL,3,8
79066K,RETRO MOD TRAY,3,12
23015,CORDIAL GLASS JUG,3,7
23014,GLASS APOTHECARY BOTTLE ELIXIR,3,9
23013,GLASS APOTHECARY BOTTLE TONIC,3,6
23007, SPACEBOY BABY GIFT SET,3,6
22219,LOVEBIRD HANGING DECORATION WHITE ,3,26
21918,SET 12 KIDS COLOUR  CHALK STICKS,3,16
21908,CHOCOLATE THIS WAY METAL SIGN,3,26
84997A,CHILDRENS CUTLERY POLKADOT GREEN ,3,13
22672,FRENCH BATHROOM SIGN BLUE METAL,3,16
22668,PINK BABY BUNTING,3,60
22664,TOY TIDY DOLLY GIRL DESIGN,3,12
21833,CAMOUFLAGE LED TORCH,3,30
23183,MOTHER'S KITCHEN SPOON REST ,3,8
23178,JAM CLOCK MAGNET,3,5
22270,HAPPY EASTER HANGING DECORATION,3,7
22251,BIRDHOUSE DECORATION MAGIC GARDEN,3,16
21194,PINK  HONEYCOMB PAPER FAN,3,10
22243,5 HOOK HANGER RED MAGIC TOADSTOOL,3,11
22242,5 HOOK HANGER MAGIC TOADSTOOL,3,34
22241,GARLAND WOODEN HAPPY EASTER,3,4
21896,POTTING SHED TWINE,3,5
22950,36 DOILIES VINTAGE CHRISTMAS,3,324
22684,FRENCH BLUE METAL DOOR SIGN 9,3,13
22681,FRENCH BLUE METAL DOOR SIGN 6,3,12
72351B,SET/6 PINK  BUTTERFLY T-LIGHTS,3,3
23325,RUSTIC STRAWBERRY JAM POT SMALL,3,18
23323,WHITE WICKER STAR ,3,3
21870,I CAN ONLY PLEASE ONE PERSON MUG,3,26
22675,FRENCH KITCHEN SIGN BLUE METAL,3,27
85054,FRENCH ENAMEL POT W LID,3,4
23351,ROLL WRAP 50'S CHRISTMAS,3,96
23347,I LOVE LONDON BEAKER,3,34
84509A,SET OF 4 ENGLISH ROSE PLACEMATS,3,9
84459A,PINK METAL CHICKEN HEART ,3,60
22486,PLASMATRONIC LAMP,3,6
23028,DRAWER KNOB CRACKLE GLAZE BLUE,3,7
22503,CABIN BAG VINTAGE PAISLEY,3,19
72802C,check,3,75
72802B,check,3,290
21395,BLUE POLKADOT BEAKER ,3,10
85040B,SET/4 BLUE FLOWER CANDLES IN BOWL,3,4
22712,CARD DOLLY GIRL ,3,25
22302,COFFEE MUG PEARS  DESIGN,3,12
21041,RED RETROSPOT OVEN GLOVE DOUBLE,3,3
21034,REX CASH+CARRY JUMBO SHOPPER,3,21
22294,HEART FILIGREE DOVE  SMALL,3,34
22278,OVERNIGHT BAG VINTAGE ROSE PAISLEY,3,6
22745,POPPY'S PLAYHOUSE BEDROOM ,3,13
22741,FUNKY DIVA PEN,3,51
21820,GLITTER HEART GARLAND WITH BELLS ,3,30
21812,GARLAND WITH HEARTS AND BELLS,3,14
23382,BOX OF 6 CHRISTMAS CAKE DECORATIONS,3,17
23374,RED SPOT PAPER GIFT BAG,3,16
23354,6 GIFT TAGS 50'S CHRISTMAS ,3,60
21791,VINTAGE HEADS AND TAILS CARD GAME ,3,36
21788,KIDS RAIN MAC BLUE,3,22
21787,RAIN PONCHO RETROSPOT,3,528
23425,STORAGE TIN HOME SWEET HOME,3,7
23423,PANTRY 3 HOOK ROLLING PIN HANGER,3,5
23408,PHOTO FRAME LINEN AND LACE SMALL,3,14
23403,LETTER HOLDER HOME SWEET HOME,3,3
23401,RUSTIC MIRROR WITH LACE HEART,3,3
21067,VINTAGE RED TEATIME MUG,3,27
22299,PIG KEYRING WITH LIGHT & SOUND ,3,52
23154,SET OF 4 JAM JAR MAGNETS,3,61
23152,IVORY SWEETHEART WIRE LETTER RACK ,3,7
23144,ZINC T-LIGHT HOLDER STARS SMALL,3,44
22329,ROUND CONTAINER SET OF 5 RETROSPOT,3,17
84352,SILVER CHRISTMAS TREE BAUBLE STAND ,3,4
23159,SET OF 5 PANCAKE DAY MAGNETS,3,25
23158,SET OF 5 LUCKY CAT MAGNETS ,3,60
21749,LARGE RED RETROSPOT WINDMILL,3,8
21746,SMALL RED RETROSPOT WINDMILL,3,15
23433,HANGING QUILTED PATCHWORK APPLES,3,47
23431,NATURAL HANGING QUILTED HEARTS ,3,16
21426,WOODLAND STORAGE BOX SMALL,3,4
48188,DOORMAT WELCOME PUPPIES,3,5
23542,WALL ART 70'S ALPHABET ,3,6
21705,BAG 500g SWIRLY MARBLES,3,20
21704,BAG 250g SWIRLY MARBLES,3,5
23081,GREEN METAL BOX ARMY SUPPLIES,3,6
23132,SMALL IVORY HEART WALL ORGANISER,3,4
23127,FELTCRAFT GIRL NICOLE KIT,3,13
23077,DOUGHNUT LIP GLOSS ,3,60
21068,VINTAGE BILLBOARD LOVE/HATE MUG,3,42
23493,VINTAGE DOILY TRAVEL SEWING KIT,3,6
22763,KEY CABINET MA CAMPAGNE,3,5
22774,RED DRAWER KNOB ACRYLIC EDWARDIAN,3,16
23582,VINTAGE DOILY JUMBO BAG RED ,3,121
21655,HANGING RIDGE GLASS T-LIGHT HOLDER,3,36
21427,SKULLS STORAGE BOX SMALL,3,3
22911,PAPER CHAIN KIT LONDON,3,6
22900, SET 2 TEA TOWELS I LOVE LONDON ,3,8
22899,CHILDREN'S APRON DOLLY GIRL ,3,5
22804,PINK HANGING HEART T-LIGHT HOLDER,3,164
85141,JARDIN ETCHED GLASS FRUITBOWL,3,9
21135,VICTORIAN  METAL POSTCARD SPRING,3,296
23083,SET 6 PAPER TABLE LANTERN STARS ,3,63
22444,GROW YOUR OWN PLANT IN A CAN ,3,32
22441,GROW YOUR OWN BASIL IN ENAMEL MUG,3,3
37500,TEA TIME TEAPOT IN GIFT BOX,3,3
37342,POLKADOT COFFEE CUP & SAUCER PINK,3,56
47594B,SCOTTIES DESIGN WASHBAG,3,4
46000S,POLYESTER FILLER PAD 40x40cm,3,44
22399,MAGNETS PACK OF 4 CHILDHOOD MEMORY,3,24
84687,BEACH HUT SHELF W 3 DRAWERS,3,4
84665,SQUARE CHERRY BLOSSOM CABINET,3,20
84663A,GRASS HOPPER WOODEN WALL CLOCK ,3,5
22413,METAL SIGN TAKE IT OR LEAVE IT ,3,18
22439,6 ROCKET BALLOONS ,3,68
22433,WATERING CAN GREEN DINOSAUR,3,3
22432,WATERING CAN PINK BUNNY,3,14
22431,WATERING CAN BLUE ELEPHANT,3,8
23103,JINGLE BELL HEART DECORATION,3,28
20703,BLUE PADDED SOFT MOBILE,3,7
85131A,BEADED PEARL HEART WHITE ON STICK,3,13
22795,SWEETHEART RECIPE BOOK STAND,3,17
22818,CARD CHRISTMAS VILLAGE,3,96
22809,SET OF 6 T-LIGHTS SANTA,3,30
21579,LOLITA  DESIGN  COTTON TOTE BAG,3,10
21564,PINK  HEART SHAPE LOVE BUCKET ,3,3
48185,DOORMAT FAIRY CAKE,3,674
48184,DOORMAT ENGLISH ROSE ,3,6
48173C,DOORMAT BLACK FLOCK ,3,5
15039,SANDALWOOD FAN,3,26
21471,STRAWBERRY RAFFIA FOOD COVER,3,4
21524,DOORMAT SPOTTY HOME SWEET HOME,3,6
21523,DOORMAT FANCY FONT HOME SWEET HOME,3,5
21519,GIN & TONIC DIET GREETING CARD ,3,36
17003,BROCADE RING PURSE ,3,3
85194S,HANGING SPRING FLOWER EGG SMALL,3,29
85194L,HANGING SPRING FLOWER EGG LARGE,3,28
85152,HAND OVER THE CHOCOLATE   SIGN ,3,74
22827,RUSTIC  SEVENTEEN DRAWER SIDEBOARD,3,3
22858,EASTER TIN KEEPSAKE,3,10
90201B,BLACK ENAMEL FLOWER RING,2,7
16169E,WRAP 50'S  CHRISTMAS,2,125
90174,BUTTERFLY HAIR BAND,2,12
90148,LONG SILVER NECKLACE PASTEL FLOWER,2,2
90143,SILVER BRACELET W PASTEL FLOWER,2,2
85199L,LARGE HANGING IVORY & RED WOOD BIRD,2,13
C2,CARRIAGE,2,2
15058B,PINK POLKADOT GARDEN PARASOL,2,5
15044D,RED PAPER PARASOL,2,2
15044C,PURPLE PAPER PARASOL,2,3
48116,DOORMAT MULTICOLOUR STRIPE,2,3
48187,DOORMAT NEW ENGLAND,2,4
21561,DINOSAUR LUNCH BOX WITH CUTLERY,2,2
21577,SAVE THE PLANET COTTON TOTE BAG,2,7
47559B,TEA TIME OVEN GLOVE,2,30
22810,SET OF 6 T-LIGHTS SNOWMEN,2,54
22812,PACK 3 BOXES CHRISTMAS PANNETONE,2,15
22822,CREAM WALL PLANTER HEART SHAPED,2,2
22797,damages,2,27
85118,HEART T-LIGHT HOLDER,2,13
21586,KINGS CHOICE GIANT TUBE MATCHES,2,13
21591,COSY HOUR CIGAR BOX MATCHES ,2,54
46138B,BLUE CHENILLE SHAGGY CUSHION COVER ,2,13
47503A,ASS FLORAL PRINT MULTI SCREWDRIVER,2,36
21484,CHICK GREY HOT WATER BOTTLE,2,48
21125,SET 6 FOOTBALL CELEBRATION CANDLES,2,2
21135,wet rusty,2,1152
21136,PAINTED METAL PEARS ASSORTED,2,9
21143,ANTIQUE GLASS HEART DECORATION ,2,2
84616,SILVER ROCCOCO CHANDELIER,2,3
84625A,PINK NEW BAROQUECANDLESTICK CANDLE,2,20
84631,FRUIT TREE AND BIRDS WALL PLAQUE,2,3
84660A,WHITE STITCHED WALL CLOCK,2,2
22377,BOTTLE BAG RETROSPOT ,2,9
22428,ENAMEL FIRE BUCKET CREAM,2,3
22434,BALLOON PUMP WITH 10 BALLOONS,2,18
22414,DOORMAT NEIGHBOURHOOD WITCH ,2,2
22417,PACK OF 60 SPACEBOY CAKE CASES,2,46
84678,CLASSICAL ROSE SMALL VASE,2,3
84688,BEACH HUT DESIGN BLACKBOARD,2,13
22393,PAPERWEIGHT VINTAGE COLLAGE,2,4
23072,MARIE ANTOINETTE TRINKET BOX SILVER,2,72
23076,ICE CREAM SUNDAE LIP GLOSS,2,28
23078,ICE CREAM PEN LIP GLOSS ,2,48
23119,PACK OF 6 LARGE FRUIT STRAWS ,2,36
23120,PACK OF 6 SMALL FRUIT STRAWS,2,72
23122,PARTY CHARMS 50 PIECES,2,3
23123,COCKTAIL SWORDS 50 PIECES,2,6
23128,FELTCRAFT BOY JEAN-PAUL KIT,2,7
23130,MISTLETOE HEART WREATH GREEN,2,9
23131,MISTLETOE HEART WREATH CREAM,2,6
22342,HOME GARLAND PAINTED ZINC ,2,36
22349,DOG BOWL CHASING BALL DESIGN,2,13
22359,GLASS JAR KINGS CHOICE,2,3
22443,GROW YOUR OWN HERBS SET OF 3,2,2
23093,SMALL PARISIENNE HEART PHOTO FRAME ,2,3
23094,LE GRAND TRAY CHIC SET,2,2
23160,REGENCY TEA SPOON,2,6
23163,REGENCY SUGAR TONGS,2,55
21172,PARTY METAL SIGN ,2,13
22331,WOODLAND PARTY BAG + STICKER SET,2,2
22338,STAR DECORATION PAINTED ZINC ,2,21
22339,CHRISTMAS TREE PAINTED ZINC ,2,31
23142,IVORY WIRE KITCHEN ORGANISER,2,2
23145,ZINC T-LIGHT HOLDER STAR LARGE,2,11
23149,ANTIQUE IVORY WIRE BOWL SMALL,2,11
23156,SET OF 5 MINI GROCERY MAGNETS,2,24
84836,ZINC METAL HEART DECORATION,2,35
84849D,HOT BATHS SOAP HOLDER,2,22
84880,WHITE WIRE EGG HOLDER,2,9
22466,FAIRY TALE COTTAGE NIGHTLIGHT,2,4
22468,BABUSHKA LIGHTS STRING OF 10,2,3
22472,TV DINNER TRAY DOLLY GIRL,2,2
84535B,FAIRY CAKES NOTEBOOK A6 SIZE,2,95
22274,FELTCRAFT DOLL EMILY,2,7
22276,WASH BAG VINTAGE ROSE PAISLEY,2,7
22283,6 EGG HOUSE PAINTED WOOD,2,4
22284,HEN HOUSE DECORATION,2,13
22248,DECORATION  PINK CHICK MAGIC GARDEN,2,20
22499,WOODEN UNION JACK BUNTING,2,4
23049,RECYCLED ACAPULCO MAT RED,2,3
23051,RECYCLED ACAPULCO MAT BLUE,2,2
84819,DANISH ROSE ROUND SEWING BOX,2,4
21035,SET/2 RED RETROSPOT TEA TOWELS ,2,200
21039,RED RETROSPOT SHOPPING BAG,2,12
21056,DOCTOR'S BAG SOFT TOY,2,2
22311,OFFICE MUG WARMER BLACK+SILVER ,2,7
22312,OFFICE MUG WARMER POLKADOT,2,26
22318,FIVE HEART HANGING DECORATION,2,7
84032A,CHARLIE+LOLA PINK HOT WATER BOTTLE,2,28
21198,WHITE HEART CONFETTI IN TUBE,2,72
22258,FELT FARM ANIMAL RABBIT,2,7
22262,FELT EGG COSY CHICKEN,2,5
22271,FELTCRAFT DOLL ROSIE,2,8
23186,FRENCH STYLE STORAGE JAR CAFE ,2,12
23188,VINTAGE  2 METER FOLDING RULER,2,13
22221,CAKE STAND LOVEBIRD 2 TIER PINK,2,2
22224,WHITE LOVEBIRD LANTERN,2,4
23022,SMALL BONNE JAM JAR  T-LIGHT HOLDER,2,30
22509,SEWING BOX RETROSPOT DESIGN ,2,16
23026,DRAWER KNOB VINTAGE GLASS STAR,2,14
23035,DRAWER KNOB CERAMIC IVORY,2,9
22489,PACK OF 12 TRADITIONAL CRAYONS,2,2
84375,SET OF 20 KIDS COOKIE CUTTERS,2,13
84507C,BLUE CIRCLES DESIGN MONKEY DOLL,2,7
23191,BUNDLE OF 3 RETRO NOTE BOOKS,2,3
23192,BUNDLE OF 3 ALPHABET EXERCISE BOOKS,2,3
84247E,PACK OF 12 CHRISTMAS FUN CARDS,2,23
22208,WOOD STAMP SET THANK YOU,2,13
22215,CAKE STAND WHITE TWO TIER LACE,2,2
22182,CAKE STAND VICTORIAN FILIGREE SMALL,2,3
22183,CAKE STAND VICTORIAN FILIGREE MED,2,2
22184,CAKE STAND VICTORIAN FILIGREE LARGE,2,2
23005,printing smudges/thrown away,2,19200
23010,CIRCUS PARADE BABY GIFT SET,2,3
22227,HANGING HEART MIRROR DECORATION ,2,2
22245,"HOOK, 1 HANGER ,MAGIC GARDEN",2,5
22199,FRYING PAN RED RETROSPOT,2,8
22201,FRYING PAN BLUE POLKADOT,2,2
22203,MILK PAN RED RETROSPOT,2,2
22204,MILK PAN BLUE POLKADOT,2,5
22162,HEART GARLAND RUSTIC PADDED,2,11
22163,HEART STRING MEMO HOLDER HANGING,2,25
23222,CHRISTMAS TREE HANGING GOLD,2,24
21224,SET/4 SKULL BADGES,2,12
21239,PINK  POLKADOT CUP,2,21
21246,RED RETROSPOT BIG BOWL,2,2
22999,TRAVEL CARD WALLET VINTAGE LEAF,2,3
22536,MAGIC DRAWING SLATE PURDEY,2,131
22550,HOLIDAY FUN LUDO,2,8
20973,12 PENCIL SMALL TUBE WOODLAND,2,4
84944,SET OF 6 KASHMIR FOLKART BAUBLES,2,58
22166,WALL MIRROR RECTANGLE DIAMANTE PINK,2,3
22175,PINK OWL SOFT TOY,2,2
22176,BLUE OWL SOFT TOY,2,2
22181,SNOWSTORM PHOTO FRAME FRIDGE MAGNET,2,27
23190,BUNDLE OF 3 SCHOOL EXERCISE BOOKS  ,2,2
23232,WRAP VINTAGE LEAF DESIGN,2,26
23224,CHERUB HEART DECORATION GOLD,2,14
22130,PARTY CONE CHRISTMAS DECORATION ,2,145
22142,CHRISTMAS CRAFT WHITE FAIRY ,2,11
22148,EASTER CRAFT 4 CHICKS ,2,15
22106,MIRROR MOSAIC HURRICANE LAMP ,2,121
21260,FIRST AID TIN,2,43
21264,WHITE GOOSE FEATHER TREE 60CM ,2,8
21272,SALLE DE BAIN HOOK,2,2
21275,ZINC TOP  2 DOOR WOODEN SHELF ,2,5
22982,PANTRY PASTRY BRUSH,2,24
22577,WOODEN HEART CHRISTMAS SCANDINAVIAN,2,101
22583,PACK OF 6 HANDBAG GIFT BOXES,2,2
22564,ALPHABET STENCIL CRAFT,2,437
84030E,ENGLISH ROSE HOT WATER BOTTLE,2,3
22152,PLACE SETTING WHITE STAR,2,4
21289,LARGE STRIPES CHOCOLATE GIFT BAG,2,20
21306,SET/4 DAISY MIRROR MAGNETS,2,19
21311,SET/4 BIRD MIRROR MAGNETS ,2,27
79323B,BLACK CHERRY LIGHTS,2,8
23237,SET OF 4 KNICK KNACK TINS LEAVES ,2,3
22095,LADS ONLY TISSUE BOX,2,9
22066,LOVE HEART TRINKET POT,2,5
22068,BLACK PIRATE TREASURE CHEST,2,13
22073,RED RETROSPOT STORAGE JAR,2,12
22586,FELTCRAFT HAIRBAND PINK AND BLUE,2,48
22592,CARDHOLDER HOLLY WREATH METAL,2,2
22597,MUSICAL ZINC HEART DECORATION ,2,34
22981,PANTRY APPLE CORER,2,6
21277,FRENCH STYLE EMBOSSED HEART CABINET,2,2
22120,WELCOME  WOODEN BLOCK LETTERS,2,12
23227,FILIGREE HEART BUTTERFLY WHITE ,2,6
22046,TEA PARTY  WRAPPING PAPER ,2,34
23287,RED VINTAGE SPOT BEAKER,2,51
23290,SPACEBOY CHILDRENS BOWL,2,10
79323P,PINK CHERRY LIGHTS,2,8
23253,16 PIECE CUTLERY SET PANTRY DESIGN,2,2
23265,SET OF 3 WOODEN TREE DECORATIONS,2,15
20956,PORCELAIN T-LIGHT HOLDERS ASSORTED,2,5
20970,PINK FLORAL FELTCRAFT SHOULDER BAG,2,3
20972,PINK CREAM FELT CRAFT TRINKET BOX ,2,24
84969,BOX OF 6 ASSORTED COLOUR TEASPOONS,2,2
84976,RECTANGULAR SHAPED MIRROR,2,14
22966,GINGERBREAD MAN COOKIE CUTTER,2,5
22082,RIBBON REEL STRIPES DESIGN ,2,20
22084,PAPER CHAIN KIT EMPIRE,2,41
22052,VINTAGE CARAVAN GIFT WRAP,2,50
21284,RETROSPOT CANDLE  SMALL,2,36
22650,CERAMIC PIRATE CHEST MONEY BANK,2,3
22653,BUTTON BOX ,2,30
22620,4 TRADITIONAL SPINNING TOPS,2,10
21976,PACK OF 60 MUSHROOM CAKE CASES,2,29
21984,PACK OF 12 PINK PAISLEY TISSUES ,2,60
21987,PACK OF 6 SKULL PAPER CUPS,2,13
21928,JUMBO BAG SCANDINAVIAN PAISLEY,2,3
78033,FLAG OF ST GEORGE CHAIR,2,3
21351,CINAMMON & ORANGE WREATH,2,7
21352,EUCALYPTUS & PINECONE  WREATH,2,9
22602,RETROSPOT WOODEN HEART DECORATION,2,40
22603,CHRISTMAS RETROSPOT TREE WOOD,2,13
22616,PACK OF 12 LONDON TISSUES ,2,24
84968C,SET OF 16 VINTAGE PISTACHIO CUTLERY,2,4
20932,PINK POT PLANT CANDLE,2,10
23283,DOORMAT VINTAGE LEAF,2,7
21926,RED/CREAM STRIPE CUSHION COVER ,2,14
21878,PACK OF 6 SANDCASTLE FLAGS ASSORTED,2,13
21889,WOODEN BOX OF DOMINOES,2,26
21892,TRADITIONAL WOODEN CATCH CUP GAME ,2,13
21359,RELAX LARGE WOOD LETTERS,2,2
21361,LOVE LARGE WOOD LETTERS ,2,4
21381,MINI WOODEN HAPPY BIRTHDAY GARLAND,2,25
79190B,RETRO PLASTIC POLKA TRAY,2,16
21972,SET OF 36 DINOSAUR PAPER DOILIES,2,2
21902,"KEY FOB , FRONT  DOOR ",2,9
21903,MAN FLU METAL SIGN,2,13
85014B,RED RETROSPOT UMBRELLA,2,2
85023B,EAU DE NILE JEWELLED PHOTOFRAME,2,73
20897,VINTAGE NOTEBOOK PARIS DAYS,2,12
20794,BLUE  TILE HOOK,2,9
20795,LARGE BLUE PROVENCAL CERAMIC BALL,2,6
21900,"KEY FOB , SHED",2,5
23299,FOOD COVER WITH BEADS SET 2 ,2,8
23306,SET OF 36 DOILIES PANTRY DESIGN,2,7
23313,VINTAGE CHRISTMAS BUNTING,2,13
23314,VINTAGE CHRISTMAS TABLECLOTH,2,5
23320,GIANT 50'S CHRISTMAS CRACKER,2,13
22663,JUMBO BAG DOLLY GIRL DESIGN,2,11
22670,FRENCH WC SIGN BLUE METAL,2,5
84988,SET OF 72 PINK HEART PAPER DOILIES,2,13
84997B,RED 3 PIECE RETROSPOT CUTLERY SET,2,28
84997C,CHILDRENS CUTLERY POLKADOT BLUE,2,6
84997D,PINK 3 PIECE POLKADOT CUTLERY SET,2,25
21907,I'M ON HOLIDAY METAL SIGN,2,13
21913,VINTAGE SEASIDE JIGSAW PUZZLES,2,3
21914,BLUE HARMONICA IN BOX ,2,36
21917,SET 12 KIDS  WHITE CHALK STICKS,2,13
22676,FRENCH BLUE METAL DOOR SIGN 1,2,11
22677,FRENCH BLUE METAL DOOR SIGN 2,2,11
21872,GLAMOROUS  MUG,2,16
23324,RUSTIC STRAWBERRY JAM POT LARGE ,2,35
23327,HANGING CLEAR MINI BOTTLE,2,8
23335,EGG FRYING PAN IVORY ,2,12
72760B,VINTAGE CREAM 3 BASKET CAKE STAND,2,2
22678,FRENCH BLUE METAL DOOR SIGN 3,2,11
22680,FRENCH BLUE METAL DOOR SIGN 5,2,30
22682,FRENCH BLUE METAL DOOR SIGN 7,2,11
22683,FRENCH BLUE METAL DOOR SIGN 8,2,12
22686,FRENCH BLUE METAL DOOR SIGN No,2,24
22689,DOORMAT MERRY CHRISTMAS RED ,2,52
22943,check,2,33
22944,CHRISTMAS METAL POSTCARD WITH BELLS,2,13
22948,METAL DECORATION NAUGHTY CHILDREN ,2,12
20821,GOLDIE LOOKING MIRROR,2,12
85042,ANTIQUE LILY FAIRY LIGHTS,2,3
72803A,ROSE SCENT CANDLE JEWELLED DRAWER,2,2
23345, DOLLY GIRL BEAKER,2,7
23349,ROLL WRAP VINTAGE CHRISTMAS,2,24
23350,ROLL WRAP VINTAGE SPOT ,2,24
23353,6 GIFT TAGS VINTAGE CHRISTMAS ,2,24
85047,WHITE BEADED GARLAND STRING 20LIGHT,2,3
85049E,SCANDINAVIAN REDS RIBBONS,2,15
85049G,CHOCOLATE BOX RIBBONS ,2,14
85059,FRENCH ENAMEL WATER BASIN,2,8
22693,GROW A FLYTRAP OR SUNFLOWER IN TIN,2,72
22704,WRAP RED APPLES ,2,50
22710,WRAP I LOVE LONDON ,2,50
22711,WRAP CIRCUS PARADE,2,50
22674,FRENCH TOILET SIGN BLUE METAL,2,13
22737,RIBBON REEL CHRISTMAS PRESENT ,2,40
22738,RIBBON REEL SNOWY VILLAGE,2,130
22744,MAKE YOUR OWN MONSOON CARD KIT,2,8
22746,POPPY'S PLAYHOUSE LIVINGROOM ,2,12
22718,CARD CAT AND TREE ,2,24
22723,SET OF 6 HERB TINS SKETCHBOOK,2,2
22929,SCHOOL DESK AND CHAIR ,2,3
22932,BAKING MOULD TOFFEE CUP CHOCOLATE,2,120
22933,BAKING MOULD EASTER EGG MILK CHOC,2,156
22937,BAKING MOULD CHOCOLATE CUPCAKES,2,13
22939,APRON APPLE DELIGHT,2,14
22691,DOORMAT WELCOME SUNRISE,2,3
22692,DOORMAT WELCOME TO OUR HOME,2,3
20801,LARGE PINK GLASS SUNDAE DISH,2,32
20802,SMALL GLASS SUNDAE DISH CLEAR,2,39
20803,SMALL PINK GLASS SUNDAE DISH,2,68
23427,STOOL HOME SWEET HOME ,2,2
21777,RECIPE BOX WITH METAL HEART,2,5
21789,KIDS RAIN MAC PINK,2,20
21822,GLITTER CHRISTMAS TREE WITH BELLS,2,3
21830,ASSORTED CREEPY CRAWLIES,2,48
23356,LOVE HOT WATER BOTTLE,2,9
23358,HOT STUFF HOT WATER BOTTLE,2,38
23368,SET 12 COLOUR PENCILS DOLLY GIRL ,2,6
23380,PACK OF 12 VINTAGE DOILY TISSUES,2,36
21794,CLASSIC FRENCH STYLE BASKET NATURAL,2,3
21810,CHRISTMAS HANGING STAR WITH BELL,2,59
21813,GARLAND WITH STARS AND BELLS,2,7
85064,CREAM SWEETHEART LETTER RACK,2,2
85071A,BLUE CHARLIE+LOLA PERSONAL DOORSIGN,2,152
85116,BLACK CANDELABRA T-LIGHT HOLDER,2,30
22736,RIBBON REEL MAKING SNOWMEN ,2,13
21422,PORCELAIN ROSE SMALL,2,4
21792,CLASSIC FRENCH STYLE BASKET GREEN ,2,9
23436,VINTAGE CHRISTMAS GIFT BAG LARGE ,2,15
23459,DOLLY CABINET 2 DRAWERS ,2,3
21743,STAR PORTABLE TABLE LIGHT ,2,9
21755,LOVE BUILDING BLOCK WORD,2,4
23469,CARD HOLDER LOVE BIRD SMALL,2,4
23480,MINI LIGHTS WOODLAND MUSHROOMS,2,20
22769,CHALKBOARD KITCHEN ORGANISER,2,10
22920,HERB MARKER BASIL,2,1527
20752,BLUE POLKADOT WASHING UP GLOVES,2,2
85061W,WHITE JEWELLED HEART DECORATION,2,7
85062,PEARL CRYSTAL PUMPKIN T-LIGHT HLDR,2,4
85063,CREAM SWEETHEART MAGAZINE RACK,2,3
23406,HOME SWEET HOME KEY HOLDER,2,3
23409,PHOTO FRAME LINEN AND LACE LARGE,2,7
22912,YELLOW COAT RACK PARIS FASHION,2,6
48194,DOORMAT HEARTS,2,3
51014L,"FEATHER PEN,LIGHT PINK",2,84
71038,WHITE HANGING BEADS CANDLE HOLDER,2,5
23574,PACKING CHARGE,2,2
35471D,SET OF 3 BIRD LIGHT PINK FEATHER ,2,2
22913,RED COAT RACK PARIS FASHION,2,4
22772,PINK DRAWER KNOB ACRYLIC EDWARDIAN,2,3
22775,PURPLE DRAWERKNOB ACRYLIC EDWARDIAN,2,28
22750,FELTCRAFT PRINCESS LOLA DOLL,2,6
22759,SET OF 3 NOTEBOOKS IN PARCEL,2,24
23503,PLAYING CARDS KEEP CALM & CARRY ON,2,2
23526,WALL ART DOG LICENCE ,2,16
23527,WALL ART ANIMALS AND NATURE ,2,7
23534,WALL ART STOP FOR TEA ,2,7
23565,EGG CUP MILKMAID HELGA ,2,5
21498,RED RETROSPOT WRAP ,2,50
21499,BLUE POLKADOT WRAP,2,225
47591D,PINK FAIRY CAKE CHILDRENS APRON,2,2
47599B,BLUE PARTY BAGS ,2,52
35648,VINTAGE BEAD PINK PURSE ,2,25
35648,check,2,56
35810B,ENAMEL BLUE RIM COFFEE CONTAINER,2,13
21624,VINTAGE UNION JACK DOORSTOP,2,5
21644,ASSORTED TUTTI FRUTTI HEART BOX,2,25
35971,ROSE FOLKART HEART DECORATIONS,2,17
37340,MULTICOLOUR SPRING FLOWER MUG,2,3
20717,STRAWBERRY SHOPPER BAG,2,22
85132A,CHARLIE + LOLA BISCUITS TINS,2,2
22805,BLUE DRAWER KNOB ACRYLIC EDWARDIAN,2,13
22902,TOTE BAG I LOVE LONDON,2,24
22908,PACK OF 20 NAPKINS RED APPLES,2,3
20675,BLUE POLKADOT BOWL,2,12
90199C,5 STRAND GLASS NECKLACE CRYSTAL,2,2
90185B,AMETHYST DIAMANTE EXPANDABLE RING,2,9
22851,SET 20 NAPKINS FAIRY CAKES DESIGN ,2,13
22852,DOG BOWL VINTAGE CREAM,2,5
20681,PINK POLKADOT CHILDRENS UMBRELLA,2,2
85170D,SET/6 PINK BIRD T-LIGHT CANDLES,2,5
85172,HYACINTH BULB T-LIGHT CANDLES,2,81
85183A,CHARLIE & LOLA WASTEPAPER BIN BLUE,2,2
22896,PEG BAG APPLES DESIGN,2,18
47580,TEA TIME DES TEA COSY,2,12
21459,YELLOW EASTER EGG HUNT START POST,2,8
21461,BLUE EASTER EGG HUNT START POST,2,2
21467,CHERRY CROCHET FOOD COVER,2,2
21469,POLKA DOT RAFFIA FOOD COVER,2,2
21470,FLOWER VINE RAFFIA FOOD COVER,2,5
22396,MAGNETS PACK OF 4 RETRO PHOTO,2,12
22402,MAGNETS PACK OF 4 VINTAGE COLLAGE,2,12
22403,MAGNETS PACK OF 4 VINTAGE LABELS ,2,12
84536B,FAIRY CAKES NOTEBOOK A7 SIZE,2,48
21080,SET/20 RED RETROSPOT PAPER NAPKINS ,2,17
21098,CHRISTMAS TOILET ROLL,2,39
84750A,PINK SMALL GLASS CAKE STAND,2,27
84799,SPRIG LAVENDER ARTIFICIAL FLOWER,2,60
22423,damages,2,40
23114,VINTAGE LEAF CHOPPING BOARD  ,2,3
22856,ASSORTED EASTER DECORATIONS  BELLS,2,21
22860,EASTER TIN CHICKS PINK DAISY,2,15
22863,SOAP DISH BROCANTE,2,13
22829,SWEETHEART WIRE WALL TIDY,2,10
22837,HOT WATER BOTTLE BABUSHKA ,2,37
18097C,WHITE TALL PORCELAIN T-LIGHT HOLDER,2,292
10133,COLOURING PENCILS BROWN TUBE,1,10
15044A,PINK PAPER PARASOL ,1,1
15044B,BLUE PAPER PARASOL ,1,1
15058A,wet/rusty,1,30
17012C,check,1,22
17012B,check,1,70
16259,PIECE OF CAMO STATIONERY SET,1,108
16258A,SWIRLY CIRCULAR RUBBERS IN BAG,1,1
16237,SLEEPING CAT ERASERS,1,60
16235,RECYCLED PENCIL WITH RABBIT ERASER,1,1
16219,HOUSE SHAPE PENCIL SHARPENER,1,48
16202E,BLACK PHOTO ALBUM ,1,1
16169E,check,1,313
16161U,WRAP SUKI AND FRIENDS,1,25
16161P,WRAP ENGLISH ROSE ,1,25
16054,POPART RECT PENCIL SHARPENER ASST,1,108
16045,check,1,900
16008,check,1,1510
90182C,BLACK 3 BEAD DROP EARRINGS,1,6
90180A,stock check,1,32
22821,GIFT BAG PSYCHEDELIC APPLES,1,12
22820,GIFT BAG BIRTHDAY,1,2
22812,PACK 3 BOXES CHRISTMAS PANETTONE,1,6
22812,?,1,270
22811,SET OF 6 T-LIGHTS CACTI ,1,1
22810,check,1,25
22808,SET OF 6 T-LIGHTS EASTER CHICKS,1,18
22895,SET OF 2 TEA TOWELS APPLE AND PEARS,1,6
22892,check,1,62
22885,NUMBER TILE VINTAGE FONT 6 ,1,1
22883,NUMBER TILE VINTAGE FONT 4,1,1
22882,NUMBER TILE VINTAGE FONT 3,1,1
22878,NUMBER TILE COTTAGE GARDEN No,1,1
22877,NUMBER TILE COTTAGE GARDEN 9,1,1
22869,NUMBER TILE COTTAGE GARDEN 1,1,1
22837,?,1,106
22759,check,1,327
22757,LARGE RED BABUSHKA NOTEBOOK ,1,1
22751,FELTCRAFT PRINCESS OLIVIA DOLL,1,2
22789,T-LIGHT HOLDER SWEETHEART HANGING,1,1
22784,damages,1,25
22778,check,1,10
22915,sold as set on dotcom,1,204
22906,12 MESSAGE CARDS WITH ENVELOPES,1,1
22904,CALENDAR PAPER CUT DESIGN,1,2
22804,Wrongly mrked had 85123a in box,1,256
22796,Not rcvd in 10/11/2010 delivery,1,360
22792,damages,1,73
22792,FLUTED ANTIQUE CANDLE HOLDER,1,12
22825,DECORATIVE PLANT POT WITH FRIEZE,1,2
22824,3 TIER SWEETHEART GARDEN SHELF,1,1
22823,test,1,22
22743,MAKE YOUR OWN FLOWERPOWER CARD KIT,1,6
22742,MAKE YOUR OWN PLAYTIME CARD KIT,1,2
22740,?,1,1060
22739,RIBBON REEL CHRISTMAS SOCK BAUBLE,1,10
22731,3D CHRISTMAS STAMPS STICKERS ,1,14
22927,?,1,40
22924,sold as set on dotcom,1,30
22923,sold as set on dotcom,1,12
22922,sold as set on dotcom,1,42
22921,HERB MARKER CHIVES ,1,12
22919,HERB MARKER MINT,1,12
22918,HERB MARKER PARSLEY,1,12
22917,HERB MARKER ROSEMARY,1,12
22916,HERB MARKER THYME,1,12
22764,"RUSTIC WOODEN CABINET, GLASS DOORS",1,1
22761,CHEST 7 DRAWER MA CAMPAGNE,1,2
22673,FRENCH GARDEN SIGN BLUE METAL,1,12
22708,WRAP DOLLY GIRL,1,25
22706,WRAP COWBOYS  ,1,25
22705,WRAP GREEN PEARS ,1,25
22700,smashed,1,48
22936,BAKING MOULD ROSE WHITE CHOCOLATE,1,72
22935,BAKING MOULD ROSE MILK CHOCOLATE,1,72
22934,BAKING MOULD EASTER EGG WHITE CHOC,1,3
22930,BAKING MOULD HEART MILK CHOCOLATE,1,96
22927,damaged,1,5
22719,wrong code,1,110
22719,wrong barcode (22467),1,178
22719,sold as 22467,1,25
22714,CARD BIRTHDAY COWBOY,1,12
22713,CARD I LOVE LONDON ,1,8
22747,POPPY'S PLAYHOUSE BATHROOM,1,6
22647,CERAMIC LOVE HEART MONEY BANK,1,12
22638,SET OF 4 NAPKIN CHARMS CROWNS ,1,1
22637,damages,1,65
22671,FRENCH LAUNDRY SIGN BLUE METAL,1,1
22669,RED BABY BUNTING ,1,50
22667,damaged,1,30
22655,damages/showroom etc,1,11
22950,SET OF 36 VINTAGE CHRISTMAS DOILIES,1,1
